{
  "$schema": "./schemas/integration_plan.schema.json",
  "$depends_on": ["requirements.json"],
  "engagement_id": "eng-2026-001",
  "version": "1.0",
  "last_updated": "2026-03-15",
  "status": "complete",

  "integration_inventory": [
    {
      "name": "IBMi RPG Programs → API Gateway",
      "source": "IBM AS/400 RPG IV programs",
      "target": "API Gateway (REST layer)",
      "direction": "bidirectional",
      "data_types": ["Patient records", "Scheduling data", "Billing data", "Pharmacy data", "Lab orders", "Clinical documents"],
      "volume": "50,000 transactions/day",
      "latency_requirement_ms": 2000,
      "criticality": "critical"
    },
    {
      "name": "DB2/400 → Application Database Cache",
      "source": "DB2/400 (EBCDIC)",
      "target": "Modern application layer",
      "direction": "read",
      "data_types": ["Patient demographics", "Reference data", "Lookup tables"],
      "volume": "2M+ records, read-heavy",
      "latency_requirement_ms": 500,
      "criticality": "critical"
    },
    {
      "name": "Modern Web UI → API Gateway",
      "source": "Browser/Mobile clients",
      "target": "API Gateway",
      "direction": "bidirectional",
      "data_types": ["UI requests", "Form submissions", "Search queries"],
      "volume": "500 concurrent users",
      "latency_requirement_ms": 2000,
      "criticality": "critical"
    },
    {
      "name": "Identity Provider (IdP) → IAM Service",
      "source": "External IdP (SAML/OIDC)",
      "target": "IAM Service",
      "direction": "bidirectional",
      "data_types": ["Authentication tokens", "User attributes", "Role mappings"],
      "volume": "500+ daily authentications",
      "latency_requirement_ms": 1000,
      "criticality": "critical"
    },
    {
      "name": "JD Edwards → Billing Module",
      "source": "JD Edwards (file-based)",
      "target": "Billing module",
      "direction": "read",
      "data_types": ["Financial data", "GL codes"],
      "volume": "Daily batch transfer",
      "latency_requirement_ms": null,
      "criticality": "medium"
    },
    {
      "name": "Audit Logger → SIEM/Compliance Store",
      "source": "Application audit events",
      "target": "Centralized audit log store",
      "direction": "outbound",
      "data_types": ["PHI access logs", "Authentication events", "Data modification logs"],
      "volume": "100,000+ events/day",
      "latency_requirement_ms": 5000,
      "criticality": "critical"
    }
  ],

  "api_contracts": [
    {
      "id": "API-001",
      "name": "Patient Registration API",
      "direction": "bidirectional",
      "protocol": "REST",
      "method": "GET/POST/PUT",
      "endpoint": "/api/v1/patients",
      "authentication": "OAuth 2.0 Bearer Token (via IAM service)",
      "request_schema": {
        "type": "object",
        "fields": ["patient_id", "first_name", "last_name", "dob", "ssn_encrypted", "mrn", "insurance_info", "demographics"]
      },
      "response_schema": {
        "type": "object",
        "fields": ["patient_id", "status", "data", "errors"]
      },
      "rate_limit": "100 requests/minute per user",
      "error_handling": "Circuit breaker with 3 failures/30s threshold, fallback to cached data for reads, retry with exponential backoff for writes",
      "sla": {
        "latency_p95_ms": 1500,
        "availability_percent": 99.9
      }
    },
    {
      "id": "API-002",
      "name": "Scheduling API",
      "direction": "bidirectional",
      "protocol": "REST",
      "method": "GET/POST/PUT/DELETE",
      "endpoint": "/api/v1/scheduling",
      "authentication": "OAuth 2.0 Bearer Token",
      "request_schema": {
        "type": "object",
        "fields": ["appointment_id", "patient_id", "provider_id", "facility_id", "date_time", "type", "duration_minutes"]
      },
      "response_schema": {
        "type": "object",
        "fields": ["appointment_id", "status", "conflicts", "data"]
      },
      "rate_limit": "200 requests/minute per user",
      "error_handling": "Optimistic locking for concurrent scheduling, conflict resolution with user notification",
      "sla": {
        "latency_p95_ms": 1000,
        "availability_percent": 99.9
      }
    },
    {
      "id": "API-003",
      "name": "Billing API",
      "direction": "bidirectional",
      "protocol": "REST",
      "method": "GET/POST/PUT",
      "endpoint": "/api/v1/billing",
      "authentication": "OAuth 2.0 Bearer Token",
      "request_schema": {
        "type": "object",
        "fields": ["claim_id", "patient_id", "service_codes", "diagnosis_codes", "provider_id", "amount"]
      },
      "response_schema": {
        "type": "object",
        "fields": ["claim_id", "status", "adjudication_result", "data"]
      },
      "rate_limit": "50 requests/minute per user",
      "error_handling": "Transaction rollback on failure, idempotent POST operations, dead letter queue for failed claim submissions",
      "sla": {
        "latency_p95_ms": 2000,
        "availability_percent": 99.9
      }
    },
    {
      "id": "API-004",
      "name": "Pharmacy API",
      "direction": "bidirectional",
      "protocol": "REST",
      "method": "GET/POST/PUT",
      "endpoint": "/api/v1/pharmacy",
      "authentication": "OAuth 2.0 Bearer Token",
      "request_schema": {
        "type": "object",
        "fields": ["order_id", "patient_id", "medication_id", "dosage", "frequency", "prescriber_id"]
      },
      "response_schema": {
        "type": "object",
        "fields": ["order_id", "status", "drug_interactions", "data"]
      },
      "rate_limit": "100 requests/minute per user",
      "error_handling": "Strict validation for controlled substances, drug interaction check before order confirmation, audit trail for all pharmacy operations",
      "sla": {
        "latency_p95_ms": 1500,
        "availability_percent": 99.95
      }
    },
    {
      "id": "API-005",
      "name": "Lab Orders API",
      "direction": "bidirectional",
      "protocol": "REST",
      "method": "GET/POST/PUT",
      "endpoint": "/api/v1/lab-orders",
      "authentication": "OAuth 2.0 Bearer Token",
      "request_schema": {
        "type": "object",
        "fields": ["order_id", "patient_id", "test_codes", "ordering_provider_id", "priority", "specimen_type"]
      },
      "response_schema": {
        "type": "object",
        "fields": ["order_id", "status", "results", "abnormal_flags", "data"]
      },
      "rate_limit": "100 requests/minute per user",
      "error_handling": "Order validation against test catalog, result notification via WebSocket for real-time updates",
      "sla": {
        "latency_p95_ms": 1500,
        "availability_percent": 99.9
      }
    },
    {
      "id": "API-006",
      "name": "Clinical Documentation API",
      "direction": "bidirectional",
      "protocol": "REST",
      "method": "GET/POST/PUT",
      "endpoint": "/api/v1/clinical-docs",
      "authentication": "OAuth 2.0 Bearer Token",
      "request_schema": {
        "type": "object",
        "fields": ["document_id", "patient_id", "author_id", "doc_type", "template_id", "content", "attachments"]
      },
      "response_schema": {
        "type": "object",
        "fields": ["document_id", "status", "version", "data"]
      },
      "rate_limit": "50 requests/minute per user",
      "error_handling": "Document locking for concurrent edits, version conflict resolution, auto-save with draft status",
      "sla": {
        "latency_p95_ms": 2000,
        "availability_percent": 99.9
      }
    },
    {
      "id": "API-007",
      "name": "IBMi Data Access Layer (DAL)",
      "direction": "bidirectional",
      "protocol": "REST",
      "method": "Internal service calls",
      "endpoint": "/internal/v1/ibmi-dal",
      "authentication": "mTLS with service identity",
      "request_schema": {
        "type": "object",
        "fields": ["program_name", "library", "parameters", "operation_type"]
      },
      "response_schema": {
        "type": "object",
        "fields": ["result_set", "status", "row_count", "errors"]
      },
      "rate_limit": "Connection pool: 50 concurrent connections to IBMi",
      "error_handling": "Connection pool management, automatic reconnect on IBMi session timeout, circuit breaker at 5 failures/60s, graceful degradation to read-only mode",
      "sla": {
        "latency_p95_ms": 500,
        "availability_percent": 99.95
      }
    },
    {
      "id": "API-008",
      "name": "IAM / Authentication API",
      "direction": "bidirectional",
      "protocol": "REST",
      "method": "POST",
      "endpoint": "/api/v1/auth",
      "authentication": "SAML 2.0 / OIDC (federated via external IdP)",
      "request_schema": {
        "type": "object",
        "fields": ["grant_type", "assertion", "mfa_token", "refresh_token"]
      },
      "response_schema": {
        "type": "object",
        "fields": ["access_token", "refresh_token", "expires_in", "user_roles", "session_id"]
      },
      "rate_limit": "20 auth attempts/minute per IP (brute-force protection)",
      "error_handling": "Account lockout after 5 failed attempts, MFA fallback to backup codes, session invalidation on suspicious activity",
      "sla": {
        "latency_p95_ms": 1000,
        "availability_percent": 99.99
      }
    },
    {
      "id": "API-009",
      "name": "Audit Logging API",
      "direction": "outbound",
      "protocol": "REST",
      "method": "POST",
      "endpoint": "/internal/v1/audit",
      "authentication": "mTLS with service identity",
      "request_schema": {
        "type": "object",
        "fields": ["event_type", "user_id", "resource_type", "resource_id", "action", "timestamp", "source_ip", "phi_accessed"]
      },
      "response_schema": {
        "type": "object",
        "fields": ["audit_id", "status"]
      },
      "rate_limit": "No rate limit (fire-and-forget with async queue)",